,Original,Summarized
18,"REPORT OF INDEPENDENT REGISTERED PUBLIC ACCOUNTING FIRM
To the Board of Directors and Stockholders of The Wendy’s Company
Opinion on the Financial Statements
We have audited the accompanying consolidated balance sheets of The Wendy’s Company and subsidiaries (the
“Company”) as of January 3, 2021 and December 29, 2019, the related consolidated statements of operations,
comprehensive income, stockholders’ equity, and cash flows, for each of the three years in the period ended January 3,
2021, and the related notes (collectively referred to as the “financial statements”). In our opinion, the financial
statements present fairly, in all material respects, the financial position of the Company as of January 3, 2021 and
December 29, 2019, and the results of its operations and its cash flows for each of the three years in the period ended
January 3, 2021, in conformity with accounting principles generally accepted in the United States of America.
We have also audited, in accordance with the standards of the Public Company Accounting Oversight Board
(United States) (PCAOB), the Company’s internal control over financial reporting as of January 3, 2021, based on
criteria established in Internal Control—Integrated Framework (2013) issued by the Committee of Sponsoring
Organizations of the Treadway Commission and our report dated March 3, 2021, expressed an unqualified opinion
on the Company’s internal control over financial reporting.
Change in Accounting Principle
As discussed in Note 1 to the financial statements, during 2019, the Company adopted the Financial
Accounting Standards Board’s (FASB) new standard related to leases using the modified retrospective approach.
Basis for Opinion
These financial statements are the responsibility of the Company’s management. Our responsibility is to express
an opinion on the Company’s financial statements based on our audits. We are a public accounting firm registered
with the PCAOB and are required to be independent with respect to the Company in accordance with the U.S.
federal securities laws and the applicable rules and regulations of the Securities and Exchange Commission and the
PCAOB.
We conducted our audits in accordance with the standards of the PCAOB. Those standards require that we
plan and perform the audit to obtain reasonable assurance about whether the financial statements are free of material
misstatement, whether due to error or fraud. Our audits included performing procedures to assess the risks of material
misstatement of the financial statements, whether due to error or fraud, and performing procedures that respond to
those risks. Such procedures included examining, on a test basis, evidence regarding the amounts and disclosures in
the financial statements. Our audits also included evaluating the accounting principles used and significant estimates
made by management, as well as evaluating the overall presentation of the financial statements. We believe that our
audits provide a reasonable basis for our opinion.
Critical Audit Matter
The critical audit matter communicated below is a matter arising from the current-period audit of the financial
statements that was communicated or required to be communicated to the audit committee and that (1) relates to
accounts or disclosures that are material to the financial statements and (2) involved our especially challenging,
subjective, or complex judgments. The communication of critical audit matters does not alter in any way our opinion
on the financial statements, taken as a whole, and we are not, by communicating the critical audit matter below,
providing a separate opinion on the critical audit matter or on the accounts or disclosures to which it relates.
Goodwill—Global Real Estate and Development Operations Reporting Unit—Refer to Notes 1 and 10 to the
financial statements
Critical Audit Matter Description
The Company’s evaluation of goodwill for impairment involves the comparison of the fair value of each
reporting unit to its carrying value.
60",We are the independent auditors of The Wendy’s Company.
19,"THE WENDY’S COMPANY AND SUBSIDIARIES
NOTES TO CONSOLIDATED FINANCIAL STATEMENTS—CONTINUED
(In Thousands Except Per Share Amounts)
Cash and Cash Equivalents
All highly liquid investments with a maturity of three months or less when acquired are considered cash
equivalents. The Company’s cash and cash equivalents principally consist of cash in bank and money market mutual
fund accounts and are primarily not in Federal Deposit Insurance Corporation insured accounts.
We believe that our vulnerability to risk concentrations in our cash equivalents is mitigated by (1) our policies
restricting the eligibility, credit quality and concentration limits for our placements in cash equivalents and
(2) insurance from the Securities Investor Protection Corporation of up to $500 per account, as well as supplemental
private insurance coverage maintained by substantially all of our brokerage firms, to the extent our cash equivalents
are held in brokerage accounts.
Restricted Cash
In accordance with the Company’s securitized financing facility, certain cash accounts have been established
with the trustee for the benefit of the trustee and the noteholders and are restricted in their use. Such restricted cash
primarily represents cash collections and cash reserves held by the trustee to be used for payments of principal, interest
and commitment fees required for the Company’s senior secured notes. Restricted cash also includes cash collected by
the Advertising Funds, usage of which is restricted for advertising activities and is included in “Advertising funds
restricted assets.” Refer to Note 7 for further information.
Accounts and Notes Receivable, Net
Accounts and notes receivable, net, consist primarily of royalties, rents, property taxes and franchise fees due
principally from franchisees, credit card receivables, insurance receivables and refundable income taxes. Reserve
estimates include consideration of the likelihood of default expected over the estimated life of the receivable. The
Company periodically assesses the need for an allowance for doubtful accounts on its receivables based upon several
key credit quality indicators such as outstanding past due balances, the financial strength of the obligor, the estimated
fair value of any underlying collateral and agreement characteristics.
We believe that our vulnerability to risk concentrations in our receivables is mitigated by (1) favorable historical
collectability on past due balances, (2) recourse to the underlying collateral regarding sales-type and direct financing
lease receivables, and (3) our expectations for fluctuations in general market conditions. Receivables are considered
delinquent once they are contractually past due under the terms of the underlying agreements. As of January 3, 2021,
there were no material receivables more than one year past due.
Inventories
The Company’s inventories are stated at the lower of cost or net realizable value, with cost determined in
accordance with the first-in, first-out method and consist primarily of restaurant food items and paper supplies.
Properties and Depreciation and Amortization
Properties are stated at cost, including capitalized internal costs of employees to the extent such employees are
dedicated to specific restaurant construction projects, less accumulated depreciation and amortization. Depreciation
and amortization of properties is computed principally on the straight-line basis using the following estimated useful
lives of the related major classes of properties: 3 to 20 years for office and restaurant equipment (including
technology), 3 to 15 years for transportation equipment and 7 to 30 years for buildings and improvements. When the
Company commits to a plan to cease using certain properties before the end of their estimated useful lives,
depreciation expense is accelerated to reflect the use of the assets over their shortened useful lives. Leasehold
improvements are amortized over the shorter of their estimated useful lives or the terms of the respective leases,
including periods covered by renewal options that the Company is reasonably assured of exercising.
69","The Wendy’s Company’s financial statements and Management’s Discussion and Analysis of Financial Condition and Results of Operations for the three months and nine months ended January 3, 2021 are available on the SEC’s website at www.sec.gov and on the Company’s website at www.wendys"
20,"THE WENDY’S COMPANY AND SUBSIDIARIES
NOTES TO CONSOLIDATED FINANCIAL STATEMENTS—CONTINUED
(In Thousands Except Per Share Amounts)
Significant Assumptions and Judgments
Management makes certain estimates and assumptions regarding each new lease and sublease agreement,
renewal and amendment, including, but not limited to, property values, market rents, property lives, discount rates
and probable term, all of which can impact (1) the classification and accounting for a lease or sublease as operating or
finance, including sales-type and direct financing, (2) the Rent Holiday and escalations in payment that are taken into
consideration when calculating Straight-Line Rent, (3) the term over which leasehold improvements for each
restaurant are amortized and (4) the values and lives of adjustments to the initial ROU asset where the Company is
the lessee, or favorable and unfavorable leases where the Company is the lessor. The amount of depreciation and
amortization, interest and rent expense and income reported would vary if different estimates and assumptions were
used.
Concentration of Risk
Wendy’s had no customers which accounted for 10% or more of consolidated revenues in 2020, 2019 or 2018.
As of January 3, 2021, Wendy’s had one main in-line distributor of food, packaging and beverage products, excluding
breads, that serviced approximately 67% of Wendy’s restaurants in the U.S. and four additional in-line distributors
that, in the aggregate, serviced approximately 32% of Wendy’s restaurants in the U.S. We believe that our
vulnerability to risk concentrations related to significant vendors and sources of our raw materials is mitigated as we
believe that there are other vendors who would be able to service our requirements. However, if a disruption of service
from any of our main in-line distributors was to occur, we could experience short-term increases in our costs while
distribution channels were adjusted.
Wendy’s restaurants are principally located throughout the U.S. and to a lesser extent, in 30 foreign countries
and U.S. territories with the largest number in Canada. Wendy’s U.S. restaurants are located in 50 states and the
District of Columbia, with the largest number in Florida, Texas, Ohio, Georgia, California, North Carolina,
Pennsylvania and Michigan. Because our restaurant operations are generally located throughout the U.S. and to a
much lesser extent, Canada and other foreign countries and U.S. territories, we believe the risk of geographic
concentration is not significant. We could be adversely affected by changing consumer preferences resulting from
concerns over nutritional or safety aspects of beef, chicken, french fries or other products we sell or the effects of food
safety events or disease outbreaks. Our exposure to foreign exchange risk is primarily related to fluctuations in the
Canadian dollar relative to the U.S. dollar for our Canadian operations. However, our exposure to Canadian dollar
foreign currency risk is mitigated by the fact that there are no Company-operated restaurants in Canada and less than
10% of Wendy’s franchised restaurants are in Canada.
The Company is subject to credit risk through its accounts receivable consisting primarily of amounts due from
franchisees for royalties, franchise fees and rent. In addition, we have notes receivable from certain of our franchisees.
The financial condition of these franchisees is largely dependent upon the underlying business trends of the Wendy’s
brand and market conditions within the quick-service restaurant industry. This concentration of credit risk is
mitigated, in part, by the number of franchisees and the short-term nature of the franchise receivables.
New Accounting Standards Adopted
Income Taxes
In December 2019, the Financial Accounting Standards Board (“FASB”) issued new guidance to simplify the
accounting for income taxes by removing certain exceptions to the general principles and the simplification of areas
such as franchise taxes, transactions that result in a step-up in the tax basis of goodwill, separate entity financial
statements and interim recognition of enactment of tax laws or tax rate changes. The Company early adopted this
amendment during the first quarter of 2020. The adoption of this guidance did not have a material impact on our
consolidated financial statements.
76",Management’s Discussion and Analysis of Financial Condition and Results of Operations
21,"THE WENDY’S COMPANY AND SUBSIDIARIES
NOTES TO CONSOLIDATED FINANCIAL STATEMENTS—CONTINUED
(In Thousands Except Per Share Amounts)
Participações Ltda. contributed $1, $2 and $2, respectively, each receiving proportionate equity interests of 20%,
40% and 40%, respectively. The Company did not receive any distributions and our share of the Brazil JV’s net losses
was $417, $1,022 and $1,344 during 2020, 2019 and 2018, respectively. A wholly-owned subsidiary of Wendy’s has
loans outstanding related to the Brazil JV totaling $17,125 and $15,920 as of January 3, 2021 and December 29,
2019, respectively. The loans are denominated in U.S. Dollars, which is also the functional currency of the subsidiary;
therefore, there is no exposure to changes in foreign currency rates. The loans bear interest at rates ranging from
3.25% to 6.5% per year. Of the total loans outstanding as of January 3, 2021, $12,775 was due primarily in the
fourth quarter of 2020 and $4,350 is due in 2024. As of January 3, 2021 and December 29, 2019, the Company had
reserves of $4,640 on the past due loans and $5,720 on the current loans outstanding, respectively, related to the
Brazil JV. The Company is currently pursuing collection of certain of the past due amounts. See Note 7 for further
information.
The carrying value of our investment in TimWen exceeded our interest in the underlying equity of the joint
venture by $23,433 and $25,160 as of January 3, 2021 and December 29, 2019, respectively, primarily due to
purchase price adjustments from the 2008 merger of Triarc Companies, Inc. and Wendy’s International, Inc. (the
“Wendy’s Merger”).
Presented below is activity related to our portion of TimWen and the Brazil JV included in our consolidated
balance sheets and consolidated statements of operations as of and for the years ended January 3, 2021, December 29,
2019 and December 30, 2018.
Year Ended
2020 2019 2018
Balance at beginning of period ........................................ $45,310 $ 47,021 $ 55,363
Investment ....................................................... — — 1 3
Equity in earnings for the period ....................................... 8,389 10,943 10,402
Amortization of purchase price adjustments (a) ............................ (2,293) (2,270) (2,326)
6,096 8,673 8,076
Distributions received ............................................... (8,376) (13,400) (13,390)
Foreign currency translation adjustment included in “Other comprehensive income
(loss), net” and other .............................................. 1,544 3,016 (3,041)
Balance at end of period ............................................. $44,574 $ 45,310 $ 47,021
(a) Purchase price adjustments that impacted the carrying value of the Company’s investment in TimWen are being
amortized over the average original aggregate life of 21 years.
Indirect Investment in Inspire Brands
In connection with the sale of Arby’s Restaurant Group, Inc. (“Arby’s”) during 2011, Wendy’s Restaurants
obtained an 18.5% equity interest in ARG Holding Corporation (“ARG Parent”) (through which Wendy’s
Restaurants indirectly retained an 18.5% interest in Arby’s). The carrying value of our investment was reduced to zero
during 2013 in connection with the receipt of a dividend that was determined to be a return of our investment.
Our 18.5% equity interest was diluted to 12.3% in February 2018, when a subsidiary of ARG Parent acquired
Buffalo Wild Wings, Inc. As a result of the acquisition, our diluted ownership interest included both the Arby’s and
Buffalo Wild Wings brands under the newly formed combined company, Inspire Brands, Inc. (“Inspire Brands”). In
August 2018, the Company sold its remaining 12.3% ownership interest to Inspire Brands for $450,000 and incurred
transaction costs of $55, which were recorded to “Investment (loss) income, net.” The Company recorded income tax
expense of $97,501 on the transaction, of which $95,038 was paid during the fourth quarter of 2018.
89","The Wendy’s Company contributed $47,021 and $55,363 to the TimWen Brazil JV during the three years ended January 3, 2021, December 29, 2019 and December 30, 2018, respectively."
22,"THE WENDY’S COMPANY AND SUBSIDIARIES
NOTES TO CONSOLIDATED FINANCIAL STATEMENTS—CONTINUED
(In Thousands Except Per Share Amounts)
The following table summarizes stock option activity during 2020:
Number of
OptionsWeighted
Average
Exercise
PriceWeighted
Average
Remaining
Contractual
Life in YearsAggregate
Intrinsic
Value
Outstanding at December 29, 2019 ............... 11,937 $13.92
Granted ..................................... 1,807 22.48
Exercised .................................... (2,395) 10.09
Forfeited and/or expired ........................ (107) 19.48
Outstanding at January 3, 2021 .................. 11,242 $16.06 6.74 $66,853
Vested or expected to vest at January 3, 2021 ........ 11,115 $16.01 6.72 $66,676
Exercisable at January 3, 2021 .................... 7,240 $13.46 5.59 $61,278
The total intrinsic value of options exercised during 2020, 2019 and 2018 was $28,111, $26,947 and $62,744,
respectively. The weighted average grant date fair value of stock options granted during 2020, 2019 and 2018 was
$6.02, $3.40 and $4.12, respectively.
The weighted average grant date fair value of stock options was determined using the following assumptions:
2020 2019 2018
Risk-free interest rate ............................................ 0.22% 1.57% 2.77%
Expected option life in years ...................................... 4.50 4.50 5.62
Expected volatility .............................................. 38.02% 23.55% 24.27%
Expected dividend yield .......................................... 1.72% 2.03% 1.84%
The risk-free interest rate represents the U.S. Treasury zero-coupon bond yield correlating to the expected life
of the stock options granted. The expected option life represents the period of time that the stock options granted are
expected to be outstanding based on historical exercise trends for similar grants. The expected volatility is based on the
historical market price volatility of the Company over a period equivalent to the expected option life. The expected
dividend yield represents the Company’s annualized average yield for regular quarterly dividends declared prior to the
respective stock option grant dates.
The Black-Scholes Model has limitations on its effectiveness including that it was developed for use in
estimating the fair value of traded options which have no vesting restrictions and are fully transferable and that the
model requires the use of highly subjective assumptions, such as expected stock price volatility. Employee stock option
awards have characteristics significantly different from those of traded options and changes in the subjective input
assumptions can materially affect the fair value estimates.
Restricted Shares
The Company grants RSAs and RSUs, which primarily cliff vest after 1 to 3 years. For the purposes of our
disclosures, the term “Restricted Shares” applies to RSAs and RSUs collectively unless otherwise noted. The fair value
of Restricted Shares granted is determined using the fair market value of the Company’s common stock on the date of
grant, as set forth in the applicable plan document.
103","The Wendy’s Company has filed its annual report on Form 10-K for the year ended December 29, 2018 with the US Securities and Exchange Commission."
23,"Item 9. Changes in and Disagreements with Accountants on Accounting and Financial Disclosure.
Not applicable.
Item 9A. Controls and Procedures.
Evaluation of Disclosure Controls and Procedures
The management of the Company, under the supervision and with the participation of the Chief Executive
Officer and Chief Financial Officer, evaluated the effectiveness of the design and operation of its disclosure controls
and procedures (as defined in Rules 13a-15(e) or 15d-15(e) under the Securities Exchange Act of 1934, as amended
(the “Exchange Act”)), as of January 3, 2021. Based on such evaluations, the Chief Executive Officer and Chief
Financial Officer concluded that as of January 3, 2021, the disclosure controls and procedures of the Company were
effective at a reasonable assurance level in (1) recording, processing, summarizing and reporting, on a timely basis,
information required to be disclosed by the Company in the reports that it files or submits under the Exchange Act
and (2) ensuring that information required to be disclosed by the Company in such reports is accumulated and
communicated to management, including the Chief Executive Officer and Chief Financial Officer, as appropriate to
allow timely decisions regarding required disclosure.
Management’s Report on Internal Control Over Financial Reporting
The management of the Company is responsible for establishing and maintaining adequate internal control
over financial reporting (as defined in Rule 13a-15(f) of the Exchange Act). The management of the Company, under
the supervision and with the participation of the Chief Executive Officer and Chief Financial Officer, carried out an
assessment of the effectiveness of its internal control over financial reporting for the Company as of January 3, 2021.
The assessment was performed using the criteria for effective internal control reflected in the Internal Control—
Integrated Framework (2013) issued by the Committee of Sponsoring Organizations of the Treadway Commission
(COSO).
Based on the assessment of the system of internal control for the Company, the management of the Company
believes that as of January 3, 2021, internal control over financial reporting of the Company was effective.
Our independent registered public accounting firm, Deloitte & Touche LLP, has issued an attestation report
dated March 3, 2021 on the Company’s internal control over financial reporting.
Changes in Internal Control Over Financial Reporting
There were no changes in the internal control over financial reporting of the Company during the fourth
quarter of 2020 that materially affected, or are reasonably likely to materially affect, its internal control over financial
reporting.
Inherent Limitations on Effectiveness of Controls
There are inherent limitations in the effectiveness of any control system, including the potential for human
error and the possible circumvention or overriding of controls and procedures. Additionally, judgments in decision-
making can be faulty and breakdowns can occur because of a simple error or mistake. An effective control system can
provide only reasonable, not absolute, assurance that the control objectives of the system are adequately met.
Accordingly, the management of the Company, including its Chief Executive Officer and Chief Financial Officer,
does not expect that the control system can prevent or detect all error or fraud. Finally, projections of any evaluation
or assessment of effectiveness of a control system to future periods are subject to the risks that, over time, controls may
become inadequate because of changes in an entity’s operating environment or deterioration in the degree of
compliance with policies or procedures.
118","On January 3, 2021, the management of the Company, under the supervision and with the participation of the Chief Executive Officer and Chief Financial Officer, evaluated the effectiveness of its disclosure controls and procedures."
