,Original,Summarized
9,"or employee benefits costs (including various federal, state and local actions to increase minimum wages),
unionization activity or other factors would adversely impact our cost of sales and operating expenses. In addition,
Wendy’s success depends on our ability to attract, motivate and retain qualified employees, including restaurant
managers and staff as well as employees and key personnel at our restaurant support center, and our inability to do so
could adversely affect our business and results of operations.
Our success depends in part upon the continued succession and retention of certain key personnel and the effectiveness
of our leadership structure.
We believe that over time our success has been dependent to a significant extent upon the efforts and abilities of
our senior leadership team and other key personnel. Our failure to retain members of our senior leadership team or
other key personnel could adversely affect our ability to build on the efforts we have undertaken to increase the
efficiency and performance of our business. In addition, changes to our leadership and organizational structure can be
inherently difficult to manage, and if we are unable to implement any such changes effectively, our business, results of
operations and financial results could be adversely affected.
Risks Related to Technology and Cybersecurity
There are risks and uncertainties associated with our increasing dependence on digital commerce platforms and
technologies and alternative methods of delivery.
Advances in technologies, including advances in digital food ordering and delivery technologies, and changes in
consumer behavior driven by such advances could have a negative effect on our business. Technology and consumer
offerings continue to develop and evolve, and we expect that new and enhanced technologies and consumer offerings
will be available in the future, including those with a focus on restaurant modernization, restaurant technology, digital
engagement, online ordering and delivery. Our inability to predict consumer acceptance of new technology or our
failure to adequately invest in new technology or adapt to technological developments and industry trends could result
in a loss of customers and related market share. In addition, our competitors, some of whom have greater resources
than we do, may be able to benefit from changes in technologies or consumer acceptance of such changes, which
could harm our competitive position and brand.
An increasing amount of our sales and revenues is derived from digital orders, which includes online ordering
and delivery. We have implemented technology and targeted advertising and promotions to support the growth of our
digital business. If we are unable to continue to grow our digital business, it may be difficult for us to achieve our
planned sales growth. If our digital commerce platforms, including the Wendy’s mobile app and online ordering
system, do not meet customers’ expectations in terms of security, speed, attractiveness or ease of use, customers may
be less inclined to return to those platforms, which could negatively impact our business, results of operations and
financial condition. Our business could also be negatively impacted if we are unable to successfully implement or
execute other consumer-facing digital initiatives, such as curbside pick-up and mobile carryout. We rely on third-
party delivery services to fulfill delivery orders, and errors or failures by those providers to make timely deliveries could
cause customers to stop ordering from us. The third-party restaurant delivery business is intensely competitive, with a
number of companies competing for capital, market share, online traffic and delivery drivers. If the third-party
delivery services that we utilize cease or curtail their operations, increase their fees or give greater priority or
promotions on their platforms to our competitors, our delivery business and our sales may be negatively impacted. If
we are unable to successfully respond to the challenges arising from our increased reliance on our digital business, this
could have a material adverse impact on our brand, business, results of operations and financial condition.
We are heavily dependent on computer systems and information technology and any material failure, misuse,
interruption or breach of our systems or technology could adversely affect our business, results of operations and
financial condition.
We are heavily dependent on our computer systems and information technology to conduct our business,
including point-of-sale processing in our restaurants, management of our supply chain, collection of cash, payment of
obligations and various other processes and procedures. Our ability to efficiently manage our business depends
significantly on the reliability and capacity of these systems and information technology. The failure of these systems
and information technology to operate effectively, an interruption in such systems or technology or a breach in
22","Risks and uncertainties that could cause our results to be materially different from those expressed or implied by our forward-looking statements include, but are not limited to:"
10,"security of these systems could be harmful and cause delays in customer service, result in the loss of data, reduce
efficiency or cause delays in operations. Significant capital investments might be required to remediate any such
problems or to maintain or upgrade our computer systems and information technology or transition to replacement
systems. Additionally, the success of certain of our strategic initiatives, including the expansion and acceleration of our
consumer-facing digital capabilities to connect with customers and drive growth, is highly dependent on our
technology systems. Any security breach involving our or our franchisees’ point-of-sale or other systems could result in
a loss of consumer confidence and potential costs associated with fraud. Also, despite our considerable efforts and
resources to secure our computer systems and information technology, security breaches, such as unauthorized access
and computer viruses, may occur, resulting in system disruptions, shutdowns or unauthorized disclosure of
confidential information, which in turn could adversely affect our business, results of operations and financial
condition.
As previously announced, we have implemented a plan to realign and reinvest resources in our IT organization
to strengthen our ability to accelerate growth. We are partnering with a third-party global IT consultant on this new
structure to leverage their global capabilities and enable a more seamless integration between our digital and corporate
IT assets. We are dependent to a significant extent on our ongoing relationship and engagement with the consultant,
including their personnel and resources, technological expertise and ability to help execute our digital, restaurant
technology and enterprise technology initiatives. The inability of us or the consultant to successfully execute our
technology growth initiatives could have an adverse impact on our business, results of operations and financial
condition.
The occurrence of cyber incidents, or a deficiency in cybersecurity, could negatively impact our brand, business, results
of operations and financial condition.
A number of retailers and other companies have experienced serious cyber incidents and breaches of their
information technology systems. As our reliance on technology has increased, so have the risks posed to our systems,
both internal and those managed by third parties. Because we and our franchisees accept electronic forms of payment
from customers, our business requires the collection and retention of customer data, including credit and debit card
numbers and other personally identifiable information, in various information systems that we and our franchisees
maintain and in those maintained by third parties with whom we and our franchisees contract to provide credit card
processing and related services. We also maintain important internal data, such as personally identifiable information
about our employees and franchisees and information relating to our operations. Our use of personally identifiable
information is regulated by international, federal and state laws, as well as by certain third-party agreements. As
privacy and information security laws and regulations change, we may incur additional costs to ensure that we remain
in compliance with those laws and regulations. If our security and information systems are compromised or if our
employees or franchisees fail to comply with these laws, regulations or contract terms, and this information is
obtained by unauthorized persons or used inappropriately, it could adversely affect our reputation, disrupt our
operations, damage our relationship with customers, franchisees or employees and result in costly litigation,
judgments, or penalties resulting from violation of applicable laws and payment card industry regulations. A cyber
incident could also require us to notify customers, employees or other groups, result in adverse publicity or a loss in
consumer confidence, sales and profits, increase fees payable to third parties or cause us to incur penalties or
remediation and other costs that could adversely affect our business, results of operations and financial condition.
While we have implemented various processes, procedures and controls to help mitigate the risk of a cyber incident
and maintain insurance coverage to address cyber incidents, these measures do not guarantee that a cyber incident
could not occur or that our reputation and financial results will not be adversely affected by such an incident.
As previously reported, in 2015 and 2016, certain of our franchisees experienced cybersecurity incidents. As a
result of those incidents, the Company was named as a defendant in separate class actions brought by consumers and
financial institutions, and certain of our directors and executive officers were named as defendants in a shareholder
derivative action. These civil proceedings sought damages and other relief allegedly arising from the cybersecurity
incidents. In February 2019, the court granted final approval of the settlement of the consumer class action, and in
November 2019, the court granted final approval of the settlement of the financial institutions class action. Both
matters are now considered fully paid and closed. In January 2020, the court granted preliminary approval of the
proposed settlement of the putative shareholder derivative action, which remains subject to certain notice and
objection provisions and final court approval. These and any other claims or investigations related to cybersecurity
23","All statements, other than statements of historical facts, included in this press release that address activities, events or developments that we expect or anticipate will or may occur in the future are forward-looking statements."
11,"incidents may adversely affect how we and our franchisees operate the business, divert the attention of management,
have a negative effect on our reputation, and adversely affect our results of operations or financial condition.
Risks Related to Our Indebtedness
The Company and certain of our subsidiaries are subject to various restrictions, and substantially all of the assets of
certain subsidiaries are security, under the terms of a securitized financing facility.
Wendy’s Funding, LLC, a limited-purpose, bankruptcy-remote, wholly owned indirect subsidiary of the
Company, is the master issuer (the “Master Issuer”) of outstanding senior secured notes under a securitized financing
facility entered into in June 2015. Under the facility, the Master Issuer issued and has outstanding certain series of
fixed rate and variable funding notes (collectively, the “Senior Notes”). The Senior Notes are secured by a security
interest in substantially all of the assets of the Master Issuer and certain other limited-purpose, bankruptcy-remote,
wholly-owned indirect subsidiaries of the Company that act as guarantors (collectively, the “Securitization Entities”),
except for certain real estate assets and subject to certain limitations as set forth in the indenture governing the Senior
Notes (the “Indenture”) and the related guarantee and collateral agreement. The assets of the Securitization Entities
include most of the domestic and certain of the foreign revenue-generating assets of the Company and its subsidiaries,
which principally consist of franchise-related agreements, certain Company-operated restaurants, intellectual property
and license agreements for the use of intellectual property.
The Senior Notes are subject to a series of covenants and restrictions customary for transactions of this type,
including (i) that the Master Issuer maintains specified reserve accounts to be used to make required payments in
respect of the Senior Notes, (ii) provisions relating to optional and mandatory prepayments and the related payment
of specified amounts, including specified make-whole payments under certain circumstances, (iii) certain
indemnification payments in the event, among other things, the assets pledged as collateral for the Senior Notes are in
stated ways defective or ineffective and (iv) covenants relating to recordkeeping, access to information and similar
matters. The Senior Notes are subject to customary rapid amortization events provided for in the Indenture,
including events tied to failure to maintain stated debt service coverage ratios, the sum of global gross sales for
specified restaurants being below certain levels on certain measurement dates, certain manager termination events, an
event of default, and the failure to repay or refinance on the applicable scheduled maturity date. The Senior Notes are
also subject to certain customary events of default, including events relating to non-payment of required interest,
principal, or other amounts due on or with respect to the Senior Notes, failure to comply with covenants within
certain time frames, certain bankruptcy events, breaches of specified representations and warranties, failure of security
interests to be effective, and certain judgments. In the event that a rapid amortization event occurs under the
Indenture (including, without limitation, upon an event of default under the Indenture or the failure to repay the
securitized debt at the end of the applicable term), the funds available to the Company would be reduced or
eliminated, which would in turn reduce our ability to operate or grow our business.
In addition, the Indenture and the related management agreement contain various covenants that limit the
Company and its subsidiaries’ ability to engage in specified types of transactions, subject to certain exceptions,
including, for example, to (i) incur or guarantee additional indebtedness, (ii) sell certain assets, (iii) create or incur
liens on certain assets to secure indebtedness or (iv) consolidate, merge, sell or otherwise dispose of all or substantially
all of their assets. As a result of these restrictions, the Company may not have adequate resources or flexibility to
continue to manage the business and provide for growth of the Wendy’s system, which could have a material adverse
effect on the Company’s future growth prospects, results of operations, financial condition and liquidity.
We have a significant amount of debt outstanding, and such indebtedness could adversely affect our business, results of
operations and financial condition.
As of January 3, 2021, the Company had approximately $2.2 billion of outstanding debt on its balance sheet.
Additionally, a subsidiary of the Company has issued variable funding notes, which allows for the borrowing of up to
$250.0 million from time to time on a revolving basis. This level of debt could have significant consequences on the
Company’s future operations, including: (i) making it more difficult to meet payment and other obligations under
outstanding debt; (ii) resulting in an event of default if the Company’s subsidiaries fail to comply with the financial
and other restrictive covenants contained in debt agreements, which event of default could result in all of the
Company’s subsidiaries’ debt becoming immediately due and payable; (iii) reducing the availability of the Company’s
24","Wendy’s International, Inc."
12,"cash flow to fund working capital, capital expenditures, equity and debt repurchases, dividends, acquisitions and other
general corporate purposes, and limiting the Company’s ability to obtain additional financing for these purposes;
(iv) subjecting the Company to the risk of increased sensitivity to interest rate increases on indebtedness with variable
interest rates; (v) limiting the Company’s flexibility in planning for or reacting to, and increasing its vulnerability to,
changes in the Company’s business, the industry in which it operates and the general economy; and (vi) placing the
Company at a competitive disadvantage compared to its competitors that are less leveraged. Further, the Company’s
outstanding variable funding notes may accrue interest based on the London interbank offered rate (“LIBOR”), which
is expected to be discontinued after 2021. If LIBOR is discontinued, we may need to renegotiate certain loan
documents and we cannot predict what alternative index would be negotiated with our lenders or the resulting impact
on our interest expense.
The ability of the Company to make payments on, repay or refinance its debt, and any additional debt, and to
fund planned capital expenditures, dividends and other cash needs will depend largely upon its future operating
performance and ability to generate significant cash flows. In addition, the ability of the Company to borrow funds in
the future to make payments on its debt will depend on the satisfaction of the covenants in the securitized financing
facility and other debt agreements, and other agreements it may enter into in the future. Specifically, the Company
will need to maintain specified financial ratios and satisfy financial condition tests. There can be no assurance that the
Company’s business will generate sufficient cash flow from operations or that future borrowings will be available
under the Company’s securitized financing facility or other debt agreements or from other sources in an amount
sufficient to enable the Company to pay its debt or to fund its dividend and other liquidity needs. If the Company’s
subsidiaries are not able to generate sufficient cash flow to service their debt obligations, they may need to refinance or
restructure debt, sell assets, reduce or delay capital investments, or seek to raise additional capital. If the Company’s
subsidiaries are unable to implement one or more of these alternatives, they may not be able to meet debt payment
and other obligations.
In addition to the Company’s outstanding indebtedness, certain of the Company’s subsidiaries have significant
contractual requirements for the purchase of soft drinks. If consumer preferences change and customers purchase
fewer soft drinks than expected or estimated, such contractual commitments may adversely affect the financial
condition of the Company. The Company has also provided loan guarantees to various lenders on behalf of
franchisees entering into debt arrangements for new restaurant development and equipment financing. In addition,
certain of the Company’s subsidiaries also guarantee or are contingently liable for certain leases of their respective
franchisees for which they have been indemnified. These commitments, guarantees and other liabilities could have an
adverse effect on the Company’s liquidity and the ability of its subsidiaries to meet payment obligations.
The Company may incur additional indebtedness, guarantees, commitments or other liabilities in the future. If
new debt, guarantees, commitments or other liabilities are added to the Company’s current consolidated debt levels,
the related risks that the Company now faces could be amplified.
Risks Related to Our Common Stock
There can be no assurance regarding whether or to what extent we will pay dividends on our common stock in the
future.
Holders of our common stock will only be entitled to receive such dividends as our Board of Directors may
declare out of funds legally available for such payments. Any dividends will be made at the discretion of our Board of
Directors and will depend on our earnings, financial condition, cash requirements and such other factors as the Board
may deem relevant from time to time. In addition, because Wendy’s is a holding company, its ability to declare and
pay dividends is dependent upon cash, cash equivalents and short-term investments on hand and cash flows from its
subsidiaries. The ability of our subsidiaries to pay cash dividends to the holding company is dependent upon their
ability to achieve sufficient cash flows after satisfying their respective cash requirements, including the requirements
and restrictions under our securitized financing facility and other debt agreements.
A substantial amount of our common stock is concentrated in the hands of certain stockholders.
Nelson Peltz, our Chairman and former Chief Executive Officer, Peter May, our Vice Chairman and former
President and Chief Operating Officer, Matthew Peltz, a director of the Company, and Edward Garden, a former
director of the Company, beneficially own shares of our outstanding common stock that collectively constitute
25","All statements, other than statements of historical facts, that address activities, events or developments that the Company expects, believes or anticipates will or may occur in the future are forward-looking statements."
