,Original,Summarized
0,"THE WENDY’S COMPANY AND SUBSIDIARIES
FORM 10-K TABLE OF CONTENTS
Page
PART I
Item 1. Business ...................................................................... 2
Item 1A. Risk Factors ................................................................... 1 3
Item 1B. Unresolved Staff Comments ....................................................... 2 9
Item 2. Properties ..................................................................... 2 9
Item 3. Legal Proceedings ............................................................... 2 9
Item 4. Mine Safety Disclosures .......................................................... 2 9
PART II
Item 5. Market for Registrant’s Common Equity, Related Stockholder Matters and Issuer Purchases of
Equity Securities .............................................................. 3 0
Item 6. Selected Financial Data ........................................................... 3 1
Item 7. Management’s Discussion and Analysis of Financial Condition and Results of Operations ........ 3 3
Item 7A. Quantitative and Qualitative Disclosures About Market Risk .............................. 5 6
Item 8. Financial Statements and Supplementary Data ......................................... 5 8
Item 9. Changes in and Disagreements with Accountants on Accounting and Financial Disclosure ....... 1 1 8
Item 9A. Controls and Procedures .......................................................... 1 1 8
Item 9B. Other Information .............................................................. 1 2 0
PART III
Item 10. Directors, Executive Officers and Corporate Governance ................................. 1 2 0
Item 11. Executive Compensation .......................................................... 1 2 0
Item 12. Security Ownership of Certain Beneficial Owners and Management and Related Stockholder
Matters ..................................................................... 1 2 0
Item 13. Certain Relationships and Related Transactions, and Director Independence .................. 1 2 0
Item 14. Principal Accountant Fees and Services ............................................... 1 2 0
PART IV
Item 15. Exhibits and Financial Statement Schedules ........................................... 1 2 0
Item 16. Form 10-K Summary ............................................................ 1 2 7","The registrant has duly caused this report to be signed on its behalf by the undersigned, thereunto duly authorised."
1,"PART I
Special Note Regarding Forward-Looking Statements and Projections
This Annual Report on Form 10-K and oral statements made from time to time by representatives of the
Company may contain or incorporate by reference certain statements that are “forward-looking statements” within
the meaning of the Private Securities Litigation Reform Act of 1995 (the “Reform Act”). Generally, forward-looking
statements include the words “may,” “believes,” “plans,” “expects,” “anticipates,” “intends,” “estimate,” “goal,”
“upcoming,” “outlook,” “guidance” or the negation thereof, or similar expressions. In addition, all statements that
address future operating, financial or business performance, strategies or initiatives, future efficiencies or savings,
anticipated costs or charges, future capitalization, anticipated impacts of recent or pending investments or transactions
and statements expressing general views about future results or brand health are forward-looking statements within
the meaning of the Reform Act. Forward-looking statements are based on our expectations at the time such
statements are made, speak only as of the dates they are made and are susceptible to a number of risks, uncertainties
and other factors. For all of our forward-looking statements, we claim the protection of the safe harbor for forward-
looking statements contained in the Reform Act. Our actual results, performance and achievements may differ
materially from any future results, performance or achievements expressed or implied by our forward-looking
statements. Many important factors could affect our future results and cause those results to differ materially from
those expressed in or implied by our forward-looking statements. Such factors include, but are not limited to, the
following:
 the disruption to our business from the novel coronavirus (COVID-19) pandemic and the impact of the
pandemic on our results of operations, financial condition and prospects;
 the impact of competition or poor customer experiences at Wendy’s restaurants;
 economic disruptions, including in regions with a high concentration of Wendy’s restaurants;
 changes in discretionary consumer spending and consumer tastes and preferences;
 impacts to our corporate reputation or the value and perception of our brand;
 the effectiveness of our marketing and advertising programs and new product development;
 our ability to manage the accelerated impact of social media;
 our ability to protect our intellectual property;
 food safety events or health concerns involving our products;
 our ability to achieve our growth strategy through new restaurant development and our Image Activation
program;
 our ability to effectively manage the acquisition and disposition of restaurants or successfully implement
other strategic initiatives;
 risks associated with leasing and owning significant amounts of real estate, including environmental matters;
 our ability to achieve and maintain market share in the breakfast daypart;
 risks associated with our international operations, including our ability to execute our international growth
strategy;
 changes in commodity and other operating costs;
 shortages or interruptions in the supply or distribution of our products and other risks associated with our
independent supply chain purchasing co-op;
 the impact of increased labor costs or labor shortages;
 the continued succession and retention of key personnel and the effectiveness of our leadership structure;
 risks associated with our digital commerce strategy, platforms and technologies, including our ability to adapt
to changes in industry trends and consumer preferences;
 our dependence on computer systems and information technology, including risks associated with the failure,
misuse, interruption or breach of our systems or technology or other cyber incidents or deficiencies;
1",This Annual Report on Form 10-K and oral statements made from time to time by representatives of the Company may contain or incorporate by reference certain statements that are “forward-looking statements” within the meaning of the Private Securities Litigation Reform Act of 1995 (the “Reform Act”.
2," risks associated with our securitized financing facility and other debt agreements, including compliance with
operational and financial covenants, restrictions on our ability to raise additional capital, the impact of our
overall debt levels and our ability to generate sufficient cash flow to meet our debt service obligations and
operate our business;
 risks associated with our capital allocation policy, including the amount and timing of equity and debt
repurchases and dividend payments;
 risks associated with complaints and litigation, compliance with legal and regulatory requirements and an
increased focus on environmental, social and governance issues;
 risks associated with the availability and cost of insurance, changes in accounting standards, the recognition
of impairment or other charges, the impact of realignment and reorganization initiatives, changes in tax rates
or tax laws and fluctuations in foreign currency exchange rates;
 conditions beyond our control, such as adverse weather conditions, natural disasters, hostilities, social unrest,
health epidemics or pandemics or other catastrophic events; and
 other risks and uncertainties referred to in this Annual Report on Form 10-K (see especially “Item 1A. Risk
Factors” and “Item 7. Management’s Discussion and Analysis of Financial Condition and Results of
Operations”) and in our other current and periodic filings with the Securities and Exchange Commission.
In addition to the factors described above, there are risks associated with our predominantly franchised business
model that could impact our results, performance and achievements. Such risks include our ability to identify, attract
and retain experienced and qualified franchisees and effectively manage the transfer of restaurants between and among
franchisees, the business and financial health of franchisees, the ability of franchisees to meet their royalty, advertising,
development, reimaging and other commitments, participation by franchisees in brand strategies and the fact that
franchisees are independent third parties that own, operate and are responsible for overseeing the operations of their
restaurants. Our predominantly franchised business model may also impact the ability of the Wendy’s system to
effectively respond and adapt to market changes. Many of these risks have been or in the future may be heightened
due to the business disruption and impact from the COVID-19 pandemic.
All future written and oral forward-looking statements attributable to us or any person acting on our behalf are
expressly qualified in their entirety by the cautionary statements contained or referred to above. New risks and
uncertainties arise from time to time, and it is impossible for us to predict these events or how they may affect us. We
assume no obligation to update any forward-looking statements after the date of this Annual Report on Form 10-K as
a result of new information, future events or developments, except as required by federal securities laws, although we
may do so from time to time. We do not endorse any projections regarding future performance that may be made by
third parties.
Explanatory Note
The Wendy’s Company (“The Wendy’s Company”) is the parent company of its 100% owned subsidiary
holding company, Wendy’s Restaurants, LLC (“Wendy’s Restaurants”). Wendy’s Restaurants is the parent company
of Wendy’s International, LLC (formerly known as Wendy’s International, Inc.). Wendy’s International, LLC is the
indirect parent company of (1) Quality Is Our Recipe, LLC (“Quality”), which is the owner and franchisor of the
Wendy’s®restaurant system in the United States and all international jurisdictions except for Canada, and
(2) Wendy’s Restaurants of Canada Inc., which is the owner and franchisor of the Wendy’s restaurant system in
Canada. As used in this report, unless the context requires otherwise, the term “Company” refers to The Wendy’s
Company and its direct and indirect subsidiaries, and “Wendy’s” refers to Quality when the context relates to
ownership of or franchising the Wendy’s restaurant system and to Wendy’s International, LLC when the context
refers to the Wendy’s brand. References in this Annual Report on Form 10-K (the “Form 10-K”) to restaurants that
we “own” or that are “Company-operated” include owned and leased restaurants.
Item 1. Business.
Company Overview
Wendy’s is primarily engaged in the business of operating, developing and franchising a system of distinctive
quick-service restaurants serving high quality food. Wendy’s opened its first restaurant in Columbus, Ohio in 1969.
2","All statements, other than statements of historical fact, that address activities, events or developments that we expect, believe or anticipate will or may occur in the future are forward-looking statements."
3,"Relations website as soon as reasonably practicable after such reports are electronically filed with, or furnished to, the
Securities and Exchange Commission. We also provide our Code of Business Conduct and Ethics, free of charge, on
our website. Our corporate website address is www.wendys.com and our Investor Relations website address is
www.irwendys.com. Information contained on those websites is not part of this Form 10-K.
Item 1A. Risk Factors.
We wish to caution readers that in addition to the important factors described elsewhere in this Form 10-K, we
have included below certain material factors that have affected, or in the future could affect, our actual results and
could cause our actual consolidated results during fiscal 2021, and beyond, to differ materially from those expressed in
or implied by any forward-looking statements made by us or on our behalf.
Risks Related to Macroeconomic and Industry Conditions
The novel coronavirus (COVID-19) pandemic has disrupted and is expected to continue to disrupt our business,
which has materially affected and could continue to materially affect our results of operations, financial condition and
prospects for an extended period of time.
In March 2020, the World Health Organization declared the novel coronavirus (COVID-19) a global
pandemic, and governmental authorities around the world implemented measures to reduce the spread of
COVID-19. These measures adversely affected customers, workforces, economies and financial markets, and, along
with decreased consumer spending, led to an economic downturn in many of our markets. Governmental restrictions
and public perceptions of the risks associated with COVID-19 have caused consumers to avoid or limit travel,
gatherings in public places and other social interactions, which has adversely affected, and could continue to adversely
affect, our business.
In response to the COVID-19 pandemic, in March 2020, we updated our brand standard to include the
closure of all dining rooms except where there were specific needs, or a drive-thru or pick-up window option was not
available, subject to applicable federal, state and local requirements. Substantially all Wendy’s restaurants continued to
offer drive-thru and delivery service to our customers. During the second quarter of 2020, we began implementing
our restaurant and dining room reopening process through a phased approach in accordance with federal, state and
local requirements, with customer and team member safety as our top priority. Dining rooms have been re-opening at
each restaurant owner’s discretion, subject to applicable regulatory restrictions. As of January 3, 2021, approximately
75% of dining rooms were open across the Wendy’s system offering carryout and, in some cases, dine in services. The
COVID-19 pandemic has also resulted in the temporary closure of certain restaurants across the Wendy’s system. As
of January 3, 2021, more than 99% of our global systemwide restaurants were operating.
As a result of the COVID-19 pandemic, our customer counts and systemwide sales have been significantly
negatively impacted. Even as mobility continues to increase, customers have been and may continue to be reluctant to
return to in-restaurant dining, and consumer spending may continue to be adversely impacted for an extended period
of time as a result of decreased consumer confidence and the impact of lost wages due to increased unemployment.
During the fourth quarter and full year of 2020, global same-restaurant sales increased 4.7% and 1.2%, respectively,
primarily driven by the positive impact of our new breakfast daypart in the United States and higher average check,
partially offset by a decline in customer counts.
The COVID-19 pandemic has also adversely affected new restaurant development and restaurant reimaging.
Due to the uncertain and challenging economic and market conditions, we delayed construction of certain new
Company-operated restaurants and reimaging of existing Company-operated restaurants and also extended the new
restaurant development and Image Activation requirements of our franchisees by one year. These delays could affect
our ability to drive future growth in our business.
The impact of the COVID-19 pandemic has had, and could continue to have, an adverse effect on our
franchisees’ operations and financial condition. Following the onset of the pandemic, we took certain actions to
support our franchisees, including extending payment terms for royalties, extending or abating payment terms for
advertising fund contributions and offering to defer base rent payments on properties owned by the Company and
leased to franchisees. To the extent our franchisees experience financial distress, including as a result of the
COVID-19 pandemic, it could negatively affect our results of operations, cash flows and financial condition through
delayed or reduced payments of royalties, advertising fund contributions or rent.
13",The Wendy’s Company
4,"The COVID-19 pandemic led, and could again lead, to interruptions in the delivery of food or other supplies
to Wendy’s restaurants arising from delays or restrictions on shipping or manufacturing, closures of supplier or
distributor facilities or financial distress or insolvency of suppliers or distributors. These delays or interruptions could
impact the availability of certain food items at Wendy’s restaurants, including beef, chicken, pork and other core
menu products. For example, we experienced disruptions to our beef supply beginning in early May 2020 as beef
suppliers across North America faced production challenges. As a result, some menu items were occasionally in short
supply at some Wendy’s system restaurants. While we and our supply chain partners effectively managed through this
disruption and the beef supply subsequently returned to normal levels across the Wendy’s system, there can be no
assurances that we will not see similar disruptions in the future. Our results of operations and those of our franchisees
could be adversely affected if our key suppliers or distributors are unable to fulfill their responsibilities and we are
unable to identify alternative suppliers or distributors in a timely manner or effectively transition the impacted
business to new suppliers or distributors.
The COVID-19 pandemic could also lead to labor shortages or increased labor costs. The risk or perceived risk
of contracting the virus could adversely affect the ability or cost of adequately staffing restaurants, which could be
exacerbated to the extent that the Company or franchisees have employees who test positive for the virus. If a
significant percentage of our or our franchisees’ workforce is unable to work, whether because of illness, quarantine,
travel limitations or other governmental actions or restrictions, our operations and the operations of our franchisees
may be negatively impacted, which could materially affect our results of operations and financial condition. We took
several actions to help support our employees and protect the health and safety of our employees and customers, such
as implementing a new emergency sick leave policy, providing temporary wage increases to restaurant employees and
purchasing additional sanitation supplies and personal protective materials, which contributed to increased operating
costs.
The impacts from the COVID-19 pandemic could have a material adverse effect on our liquidity and capital
resources. We currently believe we have the ability to pursue additional sources of liquidity if needed or desired to
fund operating cash requirements or for other purposes. However, there can be no assurance that additional liquidity
will be readily available or available on terms acceptable to us. If the disruptions caused by COVID-19 worsen, our
ability to comply with certain debt covenants under our securitized financing facility could be adversely affected.
Additionally, negative changes to our credit ratings due to the impact or expected impact of COVID-19 could have
an adverse effect on our existing indebtedness, our ability to access additional capital, our cost of borrowing and our
overall liquidity position and financial condition.
In addition to the risks described above, the COVID-19 pandemic has had, and could continue to have, the
effect of heightening other risks disclosed in this risk factors section, including, but not limited to, risks related to
competition, economic conditions and disruptions, brand value and perception, consumer preferences and spending,
commodity costs, labor, supply chain and purchasing, new restaurant development and reimaging, performance of the
breakfast daypart, franchisees, leasing and ownership of real estate, international operations, digital commerce and
technology, cybersecurity, our securitized financing facility and levels of indebtedness, complaints or litigation, legal
and regulatory requirements, impairment charges and payment of future dividends. We cannot predict the ultimate
duration, scope or severity of the COVID-19 pandemic or its ultimate impact on our results of operations, financial
condition and prospects.
Competition from other restaurant companies, as well as grocery chains and other retail food outlets, or poor customer
experience at Wendy’s restaurants, could hurt our brand.
The market segments in which Wendy’s restaurants compete are highly competitive with respect to, among
other things, price, food quality and presentation, service, location, convenience, and the nature and condition of the
restaurant facility. If customers have a poor experience at a Wendy’s restaurant, whether at a Company-operated or
franchised restaurant, we may experience a decrease in customer counts. Further, Wendy’s restaurants compete with a
variety of locally owned restaurants, as well as competitive regional, national and global restaurant chains. Several of
these chains compete by offering menu items that are targeted at certain consumer groups or dietary trends.
Additionally, many of our competitors have introduced lower cost value meal menu options and have employed
marketing strategies that include frequent use of price discounting (including through the use of coupons and other
offers), frequent promotions and heavy advertising expenditures. Some of our competitors have substantially greater
financial, marketing, personnel and other resources than we do, which may allow them to react to changes in pricing
14",The CO-19 pandemic could have a material adverse effect on our results of operations and financial condition.
