,Original,Summarized
5,"country-by-country basis by the first person to obtain protection through use or registration in that country in
connection with specific products or services. Some countries’ laws do not protect unregistered trademarks at all, or
make them more difficult to enforce, and third parties have filed, or may in the future file, for “Wendy’s” or similar
marks. Accordingly, we may not be able to adequately protect the Wendy’s brand everywhere in the world and use of
the Wendy’s brand may result in liability for trademark infringement, trademark dilution or unfair competition. In
addition, the laws of some foreign countries do not protect intellectual property rights to the same extent as the laws
of the United States. We cannot ensure that all of the steps we have taken to protect our intellectual property in the
United States and foreign countries will be adequate.
We cannot ensure that third parties will not bring infringement claims against us in the future. Any such claim,
whether or not it has merit, could be time-consuming, cause delays in introducing new menu items, require costly
modifications to advertising and promotional materials, harm our brand, image, competitive position or ability to
expand our operations into other jurisdictions, cause us to incur significant costs related to defense or settlement or
require us to enter into royalty or licensing agreements. As a result, any such claim could harm our business and
adversely impact our results of operations and financial condition. In addition, third parties may assert that certain of
our intellectual property, or our rights therein, are invalid or unenforceable. If our rights in any of our intellectual
property were found to infringe third-party rights, or portions thereof were deemed invalid or unenforceable, we may
be forced to defend or resolve related claims and incur related expenses. In addition, such loss of rights could permit
competing uses of such intellectual property which, in turn, could harm our business and adversely impact our results
of operations and financial condition.
Food safety events or health concerns regarding our products could create negative publicity and adversely affect our
brand, business and results of operations.
Food safety is a top priority for Wendy’s, and we dedicate substantial resources to food safety matters to ensure
our customers enjoy safe, quality food products. However, food safety events, including instances of food-borne illness
(such as salmonella or E. coli), have occurred in the food industry in the past, and could occur in the future. Food
safety events, whether or not involving Wendy’s restaurants or other restaurant companies, could adversely affect the
price and availability of certain products and result in negative publicity for Wendy’s or the restaurant industry. This
negative publicity may reduce demand for Wendy’s food and could result in a decrease in customer counts to
Wendy’s restaurants as consumers shift their preferences to our competitors or to other products or food types. Any
report linking our restaurants or suppliers to food-borne illnesses or food tampering, contamination, mislabeling or
other food-safety issues could damage the value of our brand immediately and severely hurt sales of our products and
possibly lead to product liability claims, litigation (including class actions) or other damages. The Wendy’s system
may also be adversely impacted by consumer concerns regarding the nutritional aspects of the products we sell, the
ingredients in our products or the cooking processes used in our restaurants. These or similar concerns could result in
less demand for our products and a decline in sales at Company-operated restaurants and in royalties from sales at
franchised restaurants.
Risks Related to Our Business Strategy
Our predominantly franchised business model presents a number of risks.
As of January 3, 2021, approximately 95% of restaurants in the Wendy’s system were operated by franchisees.
Wendy’s franchisees are contractually obligated to operate their restaurants in accordance with the standards set forth
in our franchise and other agreements with them. Wendy’s also provides training and support to franchisees.
However, franchisees are independent third parties that we do not control, and franchisees own, operate and oversee
the daily operations of their restaurants. Specifically, franchisees are solely responsible for developing and utilizing
their own policies and procedures, making their own hiring, firing and disciplinary decisions, scheduling hours and
establishing wages, and managing their day-to-day employment processes and procedures, all of which is done
independent of Wendy’s and in compliance with all applicable laws, rules or regulations. Further, franchisees have
discretion as to the prices charged to customers. As a result, the ultimate success and quality of any franchise
restaurant rests with the franchisee. If franchisees do not successfully operate their restaurants in a manner consistent
with required standards, their royalty payments to us could be adversely affected and our brand’s image and
reputation could be harmed, both of which in turn could hurt our business and results of operations. In addition, the
failure of franchisees to adequately engage in succession planning may adversely affect their restaurant operations and
development of new Wendy’s restaurants, which in turn could hurt our business and results of operations.
17","Wendy’s International, Inc., The Wendy’s Company, and its subsidiaries (collectively, “Wendy’s” or the “Company”), including, but not limited to, the trademarks “Wendy’s,” the “Wendy’s” logo, the “Wendy’s Value Menu,” the"
6,"Image Activation program. If franchisees are unable to obtain financing at commercially reasonable rates, or at all,
they may be unwilling or unable to invest in the reimaging of their existing restaurants or the development of new
restaurants, and our future growth and results of operations could be adversely affected.
We may be unable to manage effectively the acquisition and disposition of restaurants, or successfully implement other
strategic initiatives, which could adversely affect our business, results of operations and financial results.
We continue to optimize the Wendy’s system through our system optimization initiative, which includes
facilitating the transfer of restaurants between and among franchisees, as well as evaluating strategic acquisitions of
franchised restaurants and strategic dispositions of Company-operated restaurants to existing and new franchisees, to
further strengthen the franchisee base, drive new restaurant development and accelerate adoption of our Image
Activation program. The success of this initiative is dependent upon many factors, such as the availability of sellers
and buyers, the availability of financing, the ability to negotiate transactions on terms deemed acceptable and the
ability to successfully transition and integrate restaurant operations. Acquisitions of franchised restaurants pose various
risks to our operations, including (i) diversion of management’s attention to the integration of acquired restaurant
operations; (ii) increased operating expenses and the inability to achieve expected cost savings and operating
efficiencies; (iii) exposure to liabilities arising out of prior operations of acquired restaurants; and (iv) the assumption
of long-term, non-cancelable leases. Our system optimization initiative places demands on our operational and
financial management resources and may require us to expand these resources. If we are unable to execute our system
optimization initiative or effectively manage the acquisition and disposition of restaurants, our business and financial
results could be adversely affected.
In addition, Wendy’s from time to time evaluates and may pursue other opportunities for growth through new
and existing franchise partners, joint venture investments, expansion of our brand through other opportunities and
strategic mergers, acquisitions and divestitures. These strategic initiatives involve various inherent risks, including,
without limitation, general business risk, integration and synergy risk, market acceptance risk and risks associated with
the potential distraction of management. Strategic transactions may not ultimately create value for us or our
stockholders and may harm our reputation and materially adversely affect our business, results of operations and
financial condition.
Our leasing and ownership of significant amounts of real estate exposes us to possible liabilities and losses, including
liabilities associated with environmental matters.
We have significant real estate operations in connection with our business and are subject to all of the risks
associated with leasing and owning real estate. Our real estate values and the costs associated with our real estate
operations are impacted by a variety of factors, including changes in the investment climate for real estate,
macroeconomic trends, governmental regulations, insurance, demographic trends, supply and demand for the
ownership and operation of restaurants and environmental matters. A significant change in real estate values, or an
increase in costs as result of any of these factors, could adversely affect our results of operations and financial
condition.
We are subject to federal, state and local environmental, health and safety laws and regulations concerning the
discharge, storage, handling, release and disposal of hazardous or toxic substances. These environmental laws provide
for significant fines, penalties and liabilities, sometimes without regard to whether the owner, operator or occupant of
the property knew of, or was responsible for, the release or presence of the hazardous or toxic substances. Third parties
may also make claims against owners, operators or occupants of properties for personal injuries and property damage
associated with releases of or exposure to such substances. A number of our restaurant sites were formerly gas stations
or are adjacent to current or former gas stations or were used for other commercial activities that can create
environmental impacts. We have not conducted a comprehensive environmental review of all of our properties and we
may not have identified all of the potential environmental liabilities at our leased and owned properties, and any such
liabilities identified in the future could cause us to incur significant costs, including costs associated with litigation,
fines or clean-up responsibilities. We cannot predict the amount of future expenditures that may be required in order
to comply with any environmental laws or regulations or to satisfy any such claims.
We generally secure long-term real estate interests for our leased restaurants and have limited flexibility to
quickly alter our real estate portfolio. Many leases provide that the landlord may increase the rent over the term of the
19","Wendy’s risks and uncertainties include, but are not limited to, the following:"
7,"lease and any renewals of the term. Most leases require us to pay the costs of insurance, taxes, maintenance and
utilities. We generally cannot cancel these leases prior to the expiration of their term. If an existing or future restaurant
is not profitable, and we decide to close it, we may nonetheless be committed to perform our obligations under the
applicable lease including, among other things, paying rent for the balance of the lease term. In addition, as each lease
expires, we may fail to negotiate additional renewals or renewal options, either on commercially acceptable terms or at
all, which could cause us to close restaurants in desirable locations, negatively impacting our results of operations.
The breakfast daypart is competitive across the restaurant industry and we may be unable to achieve or maintain
market share or reach targeted levels of breakfast sales and profits.
Wendy’s entered the breakfast daypart across the U.S. system in March 2020. The Company and franchisee
leadership worked closely to align on a breakfast program designed to drive incremental sales and profits through a
strong economic model. However, we may be unable to achieve market share and reach targeted levels of breakfast
sales and profits due to competitive pressures and responses from our competitors, some of whom are well-established
in the breakfast daypart, or other factors, including operational complexity, food and labor costs, lack of consumer
acceptance, discretionary spending patterns that differ from other dayparts and changes to customer mobility and
daily routines, including as a result of the COVID-19 pandemic. In addition, breakfast sales could cannibalize sales
during other parts of the day and may have negative impacts on restaurant margins. The continued active support and
engagement of our franchisees is also critical for the successful performance of the breakfast daypart. The breakfast
daypart may require significant financial resources, including the Company’s plans to fund incremental marketing
and advertising campaigns. Our inability to successfully execute on our strategy for the breakfast daypart could have a
material adverse impact on our business, results of operations and financial condition.
Our international operations are subject to various risks and uncertainties and there is no assurance that our
international operations will be profitable.
In addition to many of the factors described in this risk factors section, our business outside of the United
States is subject to a number of additional factors, including international economic and political conditions, risk of
corruption and violations of the U.S. Foreign Corrupt Practices Act or similar laws of other countries, the inability to
adapt to differing cultures or consumer preferences, inadequate brand infrastructure within foreign countries to
support our international activities, inability to obtain adequate supplies meeting our quality standards and product
specifications or interruptions in obtaining such supplies, challenges and risks associated with managing and
monitoring suppliers, restrictions on our ability to move cash out of certain foreign countries, currency regulations
and fluctuations, diverse government regulations and tax systems, uncertain or differing interpretations of rights and
obligations in connection with international franchise agreements, the collection of royalties and other fees from
international franchisees, the inability to protect technology, data or intellectual property rights, compliance with
international privacy and information security laws and regulations, the availability and cost of land, construction
costs, other legal, financial or regulatory impediments to the development or operation of new restaurants and the
inability to identify, attract and retain experienced management, qualified franchisees and joint venture partners.
Adverse conditions or unforeseen events in countries that contain a high concentration of Wendy’s restaurants
(including Canada, our largest international market), could have a material adverse impact on our international
growth strategy and results of operations. In addition, to the extent we invest in international Company-operated
restaurants or joint ventures, we would also have the risk of operating losses related to those restaurants, which could
adversely affect our results of operations and financial condition. There can be no assurance that our international
growth strategy will be successful or that our international operations will be profitable.
As previously announced, Wendy’s intends to open Company-operated restaurants in the United Kingdom
and, if successful, plans to expand into other anchor markets in Europe utilizing a franchise model. New markets may
have low brand awareness as well as competitive conditions, consumer tastes, discretionary spending patterns and
social and cultural differences that are more difficult to predict or satisfy than our existing markets. We may need to
make greater investments than we originally planned in advertising and promotional activity to build brand
awareness, which could negatively impact the profitability of our operations. In addition, we may be unable to obtain
desirable locations for new restaurants at reasonable prices, or at all, and restaurants may have higher construction,
occupancy, food and labor costs than we currently anticipate. Moreover, geopolitical risks, including the United
Kingdom’s decision to leave the European Union, may result in increased regulatory complexities and economic
20","Wendy’s is subject to a number of risks and uncertainties that could cause its results of operations and financial condition to be adversely affected, including but not limited to:"
8,"uncertainty. Any of these risks and uncertainties, and other factors we cannot anticipate, could have a material adverse
impact on our business, results of operations and financial condition.
Risks Related to Supply Chain and Labor
Changes in commodity costs and other operating costs could adversely affect our results of operations.
Our profitability depends in part on our ability to anticipate and react to changes in commodity costs
(including beef, chicken, pork, cheese and grains), supplies, fuel, utilities, distribution and other operating costs.
Increases in commodity costs, particularly beef or chicken prices, could adversely affect our future results of
operations. Our business is susceptible to increases in commodity and other operating costs as a result of various
factors beyond our control, such as weather conditions and patterns, demand, food safety concerns, product recalls,
federal ethanol policy, fuel costs and government regulations. Significant increases in expenses incurred by consumers,
such as living expenses or gasoline prices, could also result in decreased customer counts at our restaurants, which
could adversely affect our business. We cannot predict whether we will be able to anticipate and react to changing
commodity costs by adjusting our purchasing practices and menu prices, and a failure to do so could adversely affect
our results of operations. In addition, we may not seek to or be able to pass along price increases to our customers. If
increased costs were passed to our customers, demand for our products may decrease, which in turn could adversely
affect our results of operations.
Shortages or interruptions in the supply or distribution of perishable food products could damage our brand and
adversely affect our business and results of operations.
Wendy’s and our franchisees are dependent on frequent deliveries of perishable food products that meet brand
specifications. Shortages or interruptions in the supply of perishable food products caused by unanticipated demand,
problems in production or distribution, disease or food-borne illnesses, political unrest, health epidemics or
pandemics, inclement weather or other calamities or conditions could adversely affect the availability, quality and cost
of ingredients, which could lower revenues, increase operating costs, damage brand reputation and otherwise harm
our business and the businesses of our franchisees. Certain of the products sold in our restaurants, such as beef and
chicken, are sourced from a limited number of suppliers, which may increase our reliance on those suppliers. In
addition, our system relies on a limited number of in-line distributors to deliver certain food, packaging and beverage
products to our restaurants. If a disruption of service from any of our key suppliers or distributors was to occur, we
could experience short-term increases in our costs while supply and distribution channels were adjusted, and we may
be unable to identify or negotiate with new suppliers or distributors on terms that are commercially reasonable to us.
As discussed above, the COVID-19 pandemic led, and could again lead, to delays or interruptions in the delivery of
food or other supplies to Wendy’s restaurants, which could impact the availability and cost of certain food items at
Wendy’s restaurants.
We do not exercise ultimate control over purchasing for our restaurant system, which could harm our business, results
of operations and financial condition.
While we require and seek to ensure that all suppliers to the Wendy’s system meet certain quality control
standards, our franchisees ultimately control the purchasing of food, proprietary paper, equipment and other
operating supplies from third party suppliers through QSCC, Wendy’s independent purchasing co-op. QSCC
manages, for the Wendy’s system in the United States and Canada, contracts for the purchase and distribution of
food, proprietary paper, equipment and other operating supplies under national agreements with pricing based on
total system volume. We do not control the decisions and activities of QSCC. If QSCC does not properly estimate
the product needs of the Wendy’s system, makes poor purchasing decisions or ceases its operations, or if our
relationship with QSCC is terminated for any reason, system sales, operating costs and supply chain management
could be adversely affected, which could harm our franchisees and have a material adverse impact on our business,
results of operations and financial condition.
Our business could be hurt by increased labor costs or labor shortages.
Labor is a primary component in the cost of operating our restaurants. We devote significant resources to
recruiting and training our managers and hourly employees. Increased labor costs due to competition, increased wages
21","Wendy’s International, Inc."
